<?xml version="1.0"?>
<!DOCTYPE practices SYSTEM "practices.dtd" [

<!ENTITY dlps-bin "/dlps_work/bin/">
<!ENTITY qa-path "/cenrepo/bin/cgi-dl/dlps/xsl/">
<!ENTITY qa-url "http://text.lib.virginia.edu/bin/cgi-dl/dlps/markupQA/">

<!ENTITY reason_date '
<reason category="delivery"><p>Provides a consistent, machine-readable way of
accessing date values. Facilitates delivery, especially as regards the ability
to perform full-text searches for specific dates or date ranges.</p></reason>
'>

<!ENTITY note_id_remarks '
<p>When creating IDs for notes, use a simple, compact,
human-readable scheme. For notes that are already numbered in the
print source, include the number in the ID. Base the ID scheme on the
referencing scheme used in the print source:</p>
<list>
<label>numbered sequentially throughout</label>
<item>If the notes are numbered sequentially throughout the entire
work, use the printed note number, prefixed with <char name="ldquo"/>n<char name="rdquo"/> (short for
<char name="ldquo"/>note<char name="rdquo"/>). For example, <val>n1</val>, <val>n2</val>, <val>n3</val>,
etc.</item>
<label>numbered within each chapter</label>
<item>If the note numbering starts over at 1 in each chapter, create a
unique ID by including the chapter number as well as the note
number. For example, the note IDs for the third chapter would be
<val>n3.1</val>, <val>n3.2</val>, <val>n3.3</val>, etc.</item>
<label>identified on each page</label>
<item>If the note numbers or symbols start over on each page, create a
unique ID by numbering the notes sequentially within each chapter. For
example, if the 35th footnote in chapter VI is indicated by an
asterisk (*), the <att>id</att> would be <val>n6.35</val> and the note
body would be marked: 
<usage applies="VENDOR">&lt;note id="n6.35" place="foot"&gt;&lt;ns&gt;*&lt;/ns&gt;...&lt;/note&gt;</usage>
<usage applies="POSTKB">&lt;note id="n6.35" place="foot"&gt;&lt;seg type="note-symbol"&gt;*&lt;/seg&gt;...&lt;/note&gt;</usage>
</item>
</list>
'>

<!ENTITY note_place_remarks '
<p>The possible values for <att>place</att> are:</p>
<list>
<label><val>end</val></label>
<item>note appears in a separate division containing all the notes for
a given section (endnotes)</item>
<label><val>foot</val></label>
<item>note appears in bottom margin (footnotes)</item>
<label><val>left</val></label>
<item>note appears in left margin (marginal notes)</item>
<label><val>right</val></label>
<item>note appears in right margin (marginal notes)</item>
<label><val>head</val></label>
<item>note appears in top margin; rarely used</item>
<label><val>inline</val></label>
<item>note appears within the main body of the text</item>
<label><val>above</val></label>
<item>note appears between the lines of the main text, above the line
to which it refers; rarely used</item>
<label><val>below</val></label>
<item>note appears between the lines of the main text, below the line
to which it refers; rarely used</item>
</list>
'>

]>
<practices>
<practicesHeader>
<docDesc>
<title type="main">TEI Markup Practices</title>
<title type="sub">Digital Library Production Services (DLPS), University of Virginia Library</title>
<respStmt>
<resp>Maintained by</resp>
<name>Greg Murray (gpm2a <hi rend="italic">at</hi> virginia <hi rend="italic">dot</hi> edu), DLPS</name>
</respStmt>
<summary>
<p>The XML source for this documentation describes the local markup
practices for TEI-encoded electronic texts followed by Digital Library
Production Services (DLPS), University of Virginia Library. It
contains three types of markup practices:</p>
<list>
<item>those applicable only to keyboarding/encoding vendors
(<char name="ldquo"/>vendor<char name="rdquo"/> practices)</item>
<item>those applicable only after a text has been received from a
vendor (<char name="ldquo"/>postkb<char name="rdquo"/> practices)</item>
<item>those applicable to both (<char name="ldquo"/>global<char name="rdquo"/>
practices)</item>
</list>
<p>The documentation is intended to be helpful in three main ways:</p>
<list>
<item>as a set of encoding guidelines for keyboarding/encoding vendors
who produce TEI texts for DLPS</item>
<item>as a reference for DLPS staff when working on QA/correction,
markup enhancement, migration, etc. of TEI texts</item>
<item>as a reference for authors of delivery systems for the digital
library, when creating delivery mechanisms for TEI texts produced by
DLPS</item>
</list>
</summary>
<revisionDesc>
<change>
<date value="2005-08">August 2005</date>
<respStmt>
<resp>author</resp>
<name>Greg Murray, DLPS</name>
</respStmt>
<changeEntry><p>Produced first published version. Documented about 100 markup
practices in 8 main categories and about 30 subcategories.</p></changeEntry>
</change>
<change>
<date value="2006-02-24">February 24, 2006</date>
<respStmt>
<resp>corrector</resp>
<name>Greg Murray, DLPS</name>
</respStmt>
<changeEntry><p>Minor corrections and enhancements to existing practices.</p></changeEntry>
</change>
<change>
<date value="2008-07-01">July 1, 2008</date>
<respStmt>
<resp>corrector</resp>
<name>Greg Murray</name>
</respStmt>
<changeEntry><p>Minor changes and additions.</p></changeEntry>
</change>
</revisionDesc>
</docDesc>
<enforcementDesc>
<dtd>
<name>The DLPS DTD (uva-dl-tei)</name>
<dtdFiles>
<dtdFile diskPath="/cenrepo/dtd/tei/tei-p4/tei2.dtd" url="http://text.lib.virginia.edu/dtd/tei/tei-p4/tei2.dtd">
	<filename>tei2.dtd</filename>
	<description>TEI P4 main (driver) file; all other files in the TEI DTD distribution are also required</description>
</dtdFile>
<dtdFile diskPath="/cenrepo/dtd/tei/uva-dl-tei/uva-dl-tei.ent" url="http://text.lib.virginia.edu/dtd/tei/uva-dl-tei/uva-dl-tei.ent">
	<filename>uva-dl-tei.ent</filename>
	<description>DLPS TEI modification file #1 of 2: entity declarations</description>
</dtdFile>
<dtdFile diskPath="/cenrepo/dtd/tei/uva-dl-tei/uva-dl-tei.dtd" url="http://text.lib.virginia.edu/dtd/tei/uva-dl-tei/uva-dl-tei.dtd">
	<filename>uva-dl-tei.dtd</filename>
	<description>DLPS TEI modification file #2 of 2: element declarations</description>
</dtdFile>
</dtdFiles>
</dtd>
<programs>
<program id="char2ent" language="Perl" type="processing" diskPath="&dlps-bin;char2ent">
	<filename>char2ent</filename>
	<description>Converts super-ASCII characters to standard mnemonic character entities, when available</description>
</program>
<program id="notes_n" language="Perl" type="processing" diskPath="&dlps-bin;notes_n">
	<filename>notes_n</filename>
	<description>Adds or updates the <att>n</att> attribute on <gi>note</gi>, <gi>ref</gi>, and <gi>ptr/</gi> elements.</description>
</program>
<program id="replace_xml_decl" language="Perl" type="processing" diskPath="&dlps-bin;replace_xml_decl">
	<filename>replace_xml_decl</filename>
	<description>Replaces XML declaration</description>
</program>
<program id="qa_dates" language="Perl" type="QA" diskPath="&dlps-bin;qa_dates">
	<filename>qa_dates</filename>
	<description>QA program for standardized date values</description>
</program>
<program id="qa_figures" language="Perl" type="QA" diskPath="&dlps-bin;qa_figures">
	<filename>qa_figures</filename>
	<description>QA program for <gi>figure</gi> elements</description>
</program>
<program id="qa_lib_corr" language="XSLT" type="QA" diskPath="&qa-path;qa_lib_corr.xsl" url="&qa-url;">
	<filename>qa_lib_corr.xsl</filename>
	<description>QA program for corrections, additions, and deletions</description>
</program>
<program id="qa_lib_foreign" language="XSLT" type="QA" diskPath="&qa-path;qa_lib_foreign.xsl" url="&qa-url;">
	<filename>qa_lib_foreign.xsl</filename>
	<description>QA program for foreign phrases and the global <att>lang</att> attribute</description>
</program>
<program id="qa_lib_misc" language="XSLT" type="QA" diskPath="&qa-path;qa_lib_misc.xsl" url="&qa-url;">
	<filename>qa_lib_misc.xsl</filename>
	<description>QA program for miscellaneous requirements not handled by the other qa_lib_* stylesheets</description>
</program>
<program id="qa_lib_notes" language="XSLT" type="QA" diskPath="&qa-path;qa_lib_notes.xsl" url="&qa-url;">
	<filename>qa_lib_notes.xsl</filename>
	<description>QA program for TEI notes and note references</description>
</program>
<program id="qa_lib_structure" language="XSLT" type="QA" diskPath="&qa-path;qa_lib_structure.xsl" url="&qa-url;">
	<filename>qa_lib_structure.xsl</filename>
	<description>QA program for TEI document structure</description>
</program>
<program id="qa_xml" language="Perl" type="QA" diskPath="&dlps-bin;qa_xml">
	<filename>qa_xml</filename>
	<description>QA program for XML features</description>
</program>
</programs>
</enforcementDesc>
</practicesHeader>
<practicesDoc>
<argument applies="VENDOR">
<p>This document describes the text encoding practices for initial
document production (keyboarding) followed by Digital Library
Production Services (DLPS), University of Virginia Library. It is
intended for use by keyboarding vendors when encoding electronic texts
for DLPS.</p>
<admon type="note">
<p>When referring to elements <gi>div1</gi> through
<gi>div7</gi> as a group, the pseudo-tag <gi tei="no">divN</gi> is used <char name="mdash"/>
for example, <char name="ldquo"/>The <att>type</att> attribute is required on <gi tei="no">divN</gi>
elements.<char name="rdquo"/></p>
<!--<p>Sections added or revised since the last major version of this
document are <hi rend="revised">highlighted with a light yellow
background</hi>.</p>-->
</admon>
</argument>
<argument applies="POSTKB">
<p>This document describes the local markup practices for TEI-encoded electronic texts
followed by Digital Library Production Services (DLPS), University of Virginia
Library. It is intended to be helpful in two main ways:</p>
<list>
<item>as a reference for DLPS staff when working on QA/correction, markup
enhancement, migration, etc. of TEI texts</item>
<item>as a reference for authors of delivery systems for the digital library,
when creating delivery mechanisms for TEI texts produced by DLPS</item>
</list>